{
  "approvalSchemaVersion": 1,
  "approvalId": "algorithms-editorial-algorithms-strategy-selection-core-compare_time_space_and_preprocessing-candidate-v1",
  "reviewKind": "editorial",
  "batchId": "algorithms-strategy-selection-core-compare_time_space_and_preprocessing-candidate-v1",
  "familyId": "algorithms",
  "trackId": "algorithms",
  "primaryTaxonomyReference": "algorithms-strategy-selection-core-compare_time_space_and_preprocessing-candidate-v1",
  "includedItems": [
    {
      "itemId": "ssc-compare-copy-and-preservation-cost",
      "itemFingerprint": "804197d7d934a96dfa61cc10df80e4f577ace5cf251de33a99acd7787680484d"
    },
    {
      "itemId": "ssc-compare-expected-vs-worst-case",
      "itemFingerprint": "ac4e805032e1ebc0a9f5e56220f7e979fefc545fa2e3069035c5c6779ae9624e"
    },
    {
      "itemId": "ssc-compare-memory-cap-overrides-time",
      "itemFingerprint": "1c19f6f708e5e980c74244429c97631d824af18ce88cf7caf5e4bd1df2ef94a2"
    },
    {
      "itemId": "ssc-compare-output-sensitive-lower-bound",
      "itemFingerprint": "d8bb7bbeead641dd4a5f741a5ad771fe42febb1f7f620d4d787a22c8edba80a9"
    },
    {
      "itemId": "ssc-compare-prefix-rebuild-with-updates",
      "itemFingerprint": "c66719c5ce199d788fb55c65732d11af960250e9ce953f6114699107897c32f5"
    },
    {
      "itemId": "ssc-compare-single-query-scan-vs-sort",
      "itemFingerprint": "eacb14726611f42399c6fd1688231910c8962907f92c7cd757c145587a713e05"
    },
    {
      "itemId": "ssc-compare-static-prefix-total-cost",
      "itemFingerprint": "f2b87209ee764961aba26b1f775b17bc9e887538abab51376008654e7a2b93f6"
    }
  ],
  "targetContentVersion": "algorithms-core-0002",
  "reviewer": "product-owner-authorized-codex-review",
  "reviewDate": "2026-07-18",
  "technicalValidationEvidenceId": "technical:11b5218a6ca02bb6a59bb40dad6bdac3780c0ef4af16babda1def69bc5ab5c3e",
  "factualAndEditorialDefectsFound": [],
  "requiredCorrections": [],
  "finalDisposition": "approved"
}
