{
  "approvalSchemaVersion": 1,
  "approvalId": "algorithms-editorial-algorithms-heap-priority-queue-heap-complexity-and-size-k-v1",
  "reviewKind": "editorial",
  "batchId": "algorithms-heap-priority-queue-heap-complexity-and-size-k-v1",
  "familyId": "algorithms",
  "trackId": "algorithms",
  "primaryTaxonomyReference": "algorithms-heap-priority-queue-heap-complexity-and-size-k-v1",
  "includedItems": [
    {
      "itemId": "hpq-complexity-bounded-top-k-total",
      "itemFingerprint": "5adef5d3d1b0003a90240911c21e2a93c01120b1dc5cc85c4e38d65aab3765c4"
    },
    {
      "itemId": "hpq-complexity-heapify-vs-inserts",
      "itemFingerprint": "22ee80a9f467daa24336ef5690a10b14533b83245dabe3af4bedb17fe89b1555"
    },
    {
      "itemId": "hpq-complexity-k-way-merge-total",
      "itemFingerprint": "c609f6f083ba5d6bf92bb375c0e277f90dedd027bd8dfada7cb2b0fa13b6a7c7"
    },
    {
      "itemId": "hpq-complexity-peek-time",
      "itemFingerprint": "bc7445cf3a4c7b574aeb0263ccc351de806b05d5cd62e28c4c63e5e2efb148e4"
    },
    {
      "itemId": "hpq-complexity-single-mutation-time",
      "itemFingerprint": "2ecc028192193d985e2ecf0422e3f5bcd4ae1de8928e16b9f67e9b3e382310fe"
    },
    {
      "itemId": "hpq-complexity-variable-heap-bound",
      "itemFingerprint": "2787c8977eb00ba457649ffbfb2a5eb37c6a6803dc5c6567695a67a090654153"
    }
  ],
  "targetContentVersion": "algorithms-core-0002",
  "reviewer": "product-owner-authorized-codex-review",
  "reviewDate": "2026-07-18",
  "technicalValidationEvidenceId": "technical:08336e68f29615efdf7621f8f4ac81c58af946b0b01419a32f8eb75a49ef1199",
  "factualAndEditorialDefectsFound": [],
  "requiredCorrections": [],
  "finalDisposition": "approved"
}
