{
  "approvalSchemaVersion": 1,
  "approvalId": "algorithms-editorial-alg-stack-maintain-monotonic-stack-invariant-candidate-v1",
  "reviewKind": "editorial",
  "batchId": "alg-stack-maintain-monotonic-stack-invariant-candidate-v1",
  "familyId": "algorithms",
  "trackId": "algorithms",
  "primaryTaxonomyReference": "alg-stack-maintain-monotonic-stack-invariant-candidate-v1",
  "includedItems": [
    {
      "itemId": "alg-stack-mono-invariant-01-decreasing-order-for-next-greater",
      "itemFingerprint": "672335c2613fe7d179d682052a8d206e73292e542055d124e6767902829c988a"
    },
    {
      "itemId": "alg-stack-mono-invariant-02-restore-invariant-before-push",
      "itemFingerprint": "361a65288021580e44d5eba64bc27fadf2b91b1eb289ecb6da194bf587d76eb6"
    },
    {
      "itemId": "alg-stack-mono-invariant-03-while-not-if",
      "itemFingerprint": "0e5e9d8e4b4a261525fe5b6debbd9cb2f6bb6fc113ba9eca36fe8a79a6fe58f6"
    },
    {
      "itemId": "alg-stack-mono-invariant-04-strict-equality-policy",
      "itemFingerprint": "c9b98ef4690eaaa03a141d1e0c36fb679493215acdc3355b0479e3032420a19e"
    },
    {
      "itemId": "alg-stack-mono-invariant-05-store-indices-for-distance",
      "itemFingerprint": "9b9d94b6a255f5521283fa3169615ac44abaa2ee0bae764f39e1b4a1c295adf9"
    },
    {
      "itemId": "alg-stack-mono-invariant-06-increasing-order-for-next-smaller",
      "itemFingerprint": "847e293e6d94f79b8360e45ee68094a75b4499f24ac1cc4e3fee9a6a83c49bb9"
    },
    {
      "itemId": "alg-stack-mono-invariant-07-candidate-lifecycle",
      "itemFingerprint": "300f324a3b0afd9e0f9f0ba8c4cbeebb4317a459374881ad60f7b2e5c9af2e07"
    },
    {
      "itemId": "alg-stack-mono-invariant-08-reverse-scan-answer-timing",
      "itemFingerprint": "b2863502071bb6934a4d0217eabc9320e7b52f90f4e3c8b42820668352c539b5"
    }
  ],
  "targetContentVersion": "algorithms-core-0001",
  "reviewer": "product-owner-authorized-codex-review",
  "reviewDate": "2026-07-18",
  "technicalValidationEvidenceId": "technical:7d167329670e080ab43c4b84d02e2bd12aae9421fc39b89638919089697ec6a8",
  "factualAndEditorialDefectsFound": [],
  "requiredCorrections": [],
  "finalDisposition": "approved"
}
