{
  "approvalSchemaVersion": 1,
  "approvalId": "algorithms-editorial-binary-search-recognize-signal-v1",
  "reviewKind": "editorial",
  "batchId": "binary-search-recognize-signal-v1",
  "familyId": "algorithms",
  "trackId": "algorithms",
  "primaryTaxonomyReference": "binary-search-recognize-signal-v1",
  "includedItems": [
    {
      "itemId": "alg-binary-search-signal-001",
      "itemFingerprint": "2c1ed1b75497f4f9c2c3e218459104cfaead3f6ea7031ed43ca586fae3befa39"
    },
    {
      "itemId": "alg-binary-search-signal-002",
      "itemFingerprint": "99a1848d01482baba021e1f04df28691ea46ffa7df93a583ee27297f82f84966"
    },
    {
      "itemId": "alg-binary-search-signal-003",
      "itemFingerprint": "6068a7ca7ef485bc59f5897772da1ce7a1956763456fb981ccb06e02ef74be2c"
    },
    {
      "itemId": "alg-binary-search-signal-004",
      "itemFingerprint": "6d0074ee84ee48a93cb142d6ea053f00f887bc6ad6d11dfb5ca90786a0bd033d"
    },
    {
      "itemId": "alg-binary-search-signal-005",
      "itemFingerprint": "65fe4a43bce9613ad06f15d6da1538c437a26ac1bf575e7a745850ddf205be60"
    },
    {
      "itemId": "alg-binary-search-signal-006",
      "itemFingerprint": "d64a4836169dd306d9e5d72f60b46742585f457a5d67c7faca778138d974d43d"
    },
    {
      "itemId": "alg-binary-search-signal-007",
      "itemFingerprint": "891ba328ac6a84f94df383abac92287a43788c784579a8d310c1c7755674231d"
    },
    {
      "itemId": "alg-binary-search-signal-008",
      "itemFingerprint": "70381bcd43dc3f3cb3c2f824734cd4bda94810e3e0b28ba17f294b21a2eb971a"
    },
    {
      "itemId": "alg-binary-search-signal-009",
      "itemFingerprint": "1075e0da70f70ec03f0994e06aa6f7cd17f4a0b1de74f8743756e68a3cc17817"
    },
    {
      "itemId": "alg-binary-search-signal-010",
      "itemFingerprint": "43035f08ccba72d9bfcecfffb7b20cddbf93a8cf28c9464dcf1a9beb37fa918b"
    },
    {
      "itemId": "alg-binary-search-signal-011",
      "itemFingerprint": "ac8f5ce8f265bda9bd8d6a74bf426aad8c8cb1eeb21556ff1d8a5dbbf8bce1d5"
    },
    {
      "itemId": "alg-binary-search-signal-012",
      "itemFingerprint": "22ca827a227e8c2110badb79d4a17581e13cb0d2a997e29bda6185f5929319b7"
    },
    {
      "itemId": "alg-binary-search-signal-013",
      "itemFingerprint": "b26ff335c868132b51bf5a9dc0f8b8767ab462633b64e9262acf4d9d92379ed2"
    },
    {
      "itemId": "alg-binary-search-signal-014",
      "itemFingerprint": "8c59638db25d98ddaa4b8cc3087ffdce766f8e0f1577e6d1cc443ba7efce881d"
    },
    {
      "itemId": "alg-binary-search-signal-015",
      "itemFingerprint": "c2731fd0cd8de30d50882b547fb9664f45d98b006a826ac1a700ed3f2ce1e6a8"
    },
    {
      "itemId": "alg-binary-search-signal-016",
      "itemFingerprint": "51b4a547d5c813e8523f41be86a8519fe5a672b68a5a54e9a3787715111fca97"
    }
  ],
  "targetContentVersion": "algorithms-core-0001",
  "reviewer": "product-owner-authorized-codex-review",
  "reviewDate": "2026-07-18",
  "technicalValidationEvidenceId": "technical:2145c0aa71ca9497b4ebdd1793475000ea22e2ababbdb7ce8819e3386bacc2aa",
  "factualAndEditorialDefectsFound": [],
  "requiredCorrections": [],
  "finalDisposition": "approved"
}
