{
  "approvalSchemaVersion": 1,
  "approvalId": "algorithms-editorial-algorithms-tree-traversal-dfs_postorder-candidate-001",
  "reviewKind": "editorial",
  "batchId": "algorithms-tree-traversal-dfs_postorder-candidate-001",
  "familyId": "algorithms",
  "trackId": "algorithms",
  "primaryTaxonomyReference": "algorithms-tree-traversal-dfs_postorder-candidate-001",
  "includedItems": [
    {
      "itemId": "alg-tree-postorder-balance-null-sentinel",
      "itemFingerprint": "d3c556a0622d9facb6b7e084e367491b7f2cdb8995a65fad38f4bcc180a7a16d"
    },
    {
      "itemId": "alg-tree-postorder-delete-ownership-boundary",
      "itemFingerprint": "0fe602e05b31d7a12e97ba0b15926571ea4552a0f9d3bd52c82a293fa98f6946"
    },
    {
      "itemId": "alg-tree-postorder-diameter-child-heights",
      "itemFingerprint": "454e8211c8195d250604c88dfc82323c80571fe51bac9acc5dffdf2c670bc827"
    },
    {
      "itemId": "alg-tree-postorder-naive-balance-recomputation",
      "itemFingerprint": "19d0b25c1bfd6a9bbe5a25bbdf5c9f36e1996f12087e5c99b46ca8315eec779c"
    },
    {
      "itemId": "alg-tree-postorder-subtree-sum-sequence",
      "itemFingerprint": "2431fd7db9ba679b0768c69a7935396d72b65f4f1e85ba2e72bf3a557c8a69d3"
    }
  ],
  "targetContentVersion": "algorithms-core-0002",
  "reviewer": "product-owner-authorized-codex-review",
  "reviewDate": "2026-07-18",
  "technicalValidationEvidenceId": "technical:222afecda6062b3e4f07919960e61c1685270903e4f0110a71e18f80c3d3c9f4",
  "factualAndEditorialDefectsFound": [],
  "requiredCorrections": [],
  "finalDisposition": "approved"
}
