{
  "approvalSchemaVersion": 1,
  "approvalId": "algorithms-editorial-algorithms-greedy-intro-greedy-mistake-review-v1",
  "reviewKind": "editorial",
  "batchId": "algorithms-greedy-intro-greedy-mistake-review-v1",
  "familyId": "algorithms",
  "trackId": "algorithms",
  "primaryTaxonomyReference": "algorithms-greedy-intro-greedy-mistake-review-v1",
  "includedItems": [
    {
      "itemId": "alg-greedy-intro-gmr-001",
      "itemFingerprint": "c0a11a7fc52259bc9f10384efb966c42ab26d05b72127383638efd7670decce0"
    },
    {
      "itemId": "alg-greedy-intro-gmr-002",
      "itemFingerprint": "386865962c4bd31aae89e30eaafd52b4070ff681d439070f9887bf5d728f424d"
    },
    {
      "itemId": "alg-greedy-intro-gmr-003",
      "itemFingerprint": "4d4cc90fd6deea80912dd4fd51c232986dbbec8664d3516fb672b825c1d511a2"
    },
    {
      "itemId": "alg-greedy-intro-gmr-004",
      "itemFingerprint": "03bd5c77b5dacc762367422a197f98ea81c9a47b32ea88bda21060c1ec7c7f69"
    },
    {
      "itemId": "alg-greedy-intro-gmr-005",
      "itemFingerprint": "d8caf7612307b5f296321d31e31da5d4e01fdd45e91fe6bc919a4d97b6f99e94"
    }
  ],
  "targetContentVersion": "algorithms-core-0002",
  "reviewer": "product-owner-authorized-codex-review",
  "reviewDate": "2026-07-18",
  "technicalValidationEvidenceId": "technical:177dcf6a720044fce3ca0267652474d5de4d6f94f2ec4026ae37e1821febfce3",
  "factualAndEditorialDefectsFound": [],
  "requiredCorrections": [],
  "finalDisposition": "approved"
}
