{
  "approvalSchemaVersion": 1,
  "approvalId": "algorithms-editorial-contrast-sliding-window-vs-prefix-sums-one-query-vs-many-queries-v1",
  "reviewKind": "editorial",
  "batchId": "contrast-sliding-window-vs-prefix-sums-one-query-vs-many-queries-v1",
  "familyId": "algorithms",
  "trackId": "algorithms",
  "primaryTaxonomyReference": "contrast-sliding-window-vs-prefix-sums-one-query-vs-many-queries-v1",
  "includedItems": [
    {
      "itemId": "alg-contrast-window-prefix-queries-001",
      "itemFingerprint": "be4a1d5a2418eabcd462e9cc2d0f868b43e1dba5f84ec60127f29210c2c0a614"
    },
    {
      "itemId": "alg-contrast-window-prefix-queries-002",
      "itemFingerprint": "326b28506cb8553015db56408cf03d02f206d17eae6f58b30a5e959e1e38d401"
    },
    {
      "itemId": "alg-contrast-window-prefix-queries-003",
      "itemFingerprint": "e94c1543910f93a4e7d7e3a6e6a6670aa389082644ad9a2f87fcbaee81eb4d39"
    },
    {
      "itemId": "alg-contrast-window-prefix-queries-004",
      "itemFingerprint": "2be933ae4fc8389eea27cd1a0aa37ed1dcde18ef39530add4e0d66857e8ad5ee"
    },
    {
      "itemId": "alg-contrast-window-prefix-queries-005",
      "itemFingerprint": "011aa9a65fd023113841a5f9dfe6650fa01d21ce7afc7f7bbed60f2591566162"
    },
    {
      "itemId": "alg-contrast-window-prefix-queries-006",
      "itemFingerprint": "545d06837ea80de0c1122cf5a5f24569cf7233638d9f789a3c2631b3b6861d56"
    },
    {
      "itemId": "alg-contrast-window-prefix-queries-007",
      "itemFingerprint": "0dead7f8e0b61dca2cbb86ff3aa5a0384c75dfad5e6b42c361dc59c6add0598b"
    },
    {
      "itemId": "alg-contrast-window-prefix-queries-008",
      "itemFingerprint": "fbd046dc1f7066f6ddde0e66cac8936fe237bf5b31489153ba9cce244b50d36c"
    },
    {
      "itemId": "alg-contrast-window-prefix-queries-009",
      "itemFingerprint": "842c5dea85fe14a3b54fc257835c1c85f1e468d873783778c5a0ceec8b8ef68f"
    },
    {
      "itemId": "alg-contrast-window-prefix-queries-010",
      "itemFingerprint": "472fecd7c51d0a26656d3a446b04d9f76f8de044621ce4ac1640af91412793b3"
    },
    {
      "itemId": "alg-contrast-window-prefix-queries-011",
      "itemFingerprint": "a920fa3fef000a6099640fa2300f9c379cbe6eb469fb690c124b5881181960fc"
    },
    {
      "itemId": "alg-contrast-window-prefix-queries-012",
      "itemFingerprint": "40280a21098927007742becf3ab42aff00743147c713e6b09b8c80d559038edd"
    },
    {
      "itemId": "alg-contrast-window-prefix-queries-013",
      "itemFingerprint": "6c34c1d1d27d1a68dbea4ed3e4ff2e8e7e2c63c1cbc0844e6ce852ade5409968"
    },
    {
      "itemId": "alg-contrast-window-prefix-queries-014",
      "itemFingerprint": "8d91b9ba4f5316551efb9ea65a09ab35390d41fa61d926dc6743a2b026613e6a"
    },
    {
      "itemId": "alg-contrast-window-prefix-queries-015",
      "itemFingerprint": "4f2752007cd2593b6cbbc852162a4b7cf115aa40d910de62d0fb51c30494f59e"
    },
    {
      "itemId": "alg-contrast-window-prefix-queries-016",
      "itemFingerprint": "7e51aba3df4b3d27faeb4a9b3bba69b756dd77a97834a0419ca994daa5705db3"
    },
    {
      "itemId": "alg-contrast-window-prefix-queries-017",
      "itemFingerprint": "d869fe4bbe3d9a65aff63e8d06fbe09b026b7d8784d4a42f88fbf9374016bdd9"
    },
    {
      "itemId": "alg-contrast-window-prefix-queries-018",
      "itemFingerprint": "996fb78c5f82f1db08407ac04b81607d8b0588a4a54f250797b7ebbc98b336f1"
    },
    {
      "itemId": "alg-contrast-window-prefix-queries-019",
      "itemFingerprint": "7b0178e348d2772d4bf2f4c89df35a7cdc49da2bfc8ffa0d277690484104ef16"
    },
    {
      "itemId": "alg-contrast-window-prefix-queries-020",
      "itemFingerprint": "4d17345030820c6771f9c831de1b71b170bc3c59c6e0fe00cfecdbf7647d3311"
    },
    {
      "itemId": "alg-contrast-window-prefix-queries-021",
      "itemFingerprint": "ad15399c1aa272dddcc3923fab04c31864eb9a74237706a1ec913c97f77178fc"
    },
    {
      "itemId": "alg-contrast-window-prefix-queries-022",
      "itemFingerprint": "824306816c976cd1cbb8fdbb97fab522951a00ec9d698e71fa185a82c69f7f42"
    }
  ],
  "targetContentVersion": "algorithms-core-0001",
  "reviewer": "product-owner-authorized-codex-review",
  "reviewDate": "2026-07-18",
  "technicalValidationEvidenceId": "technical:6f33b99706b48ff201ea4cba8761b5da7c1bced7062c004eb34b6330ab3a7504",
  "factualAndEditorialDefectsFound": [],
  "requiredCorrections": [],
  "finalDisposition": "approved"
}
