{
  "approvalSchemaVersion": 1,
  "approvalId": "algorithms-editorial-algorithms-contrast-two-pointers-vs-sliding-window-pmwvr-v1",
  "reviewKind": "editorial",
  "batchId": "algorithms-contrast-two-pointers-vs-sliding-window-pmwvr-v1",
  "familyId": "algorithms",
  "trackId": "algorithms",
  "primaryTaxonomyReference": "algorithms-contrast-two-pointers-vs-sliding-window-pmwvr-v1",
  "includedItems": [
    {
      "itemId": "alg-ctpsw-pmwvr-01",
      "itemFingerprint": "ab51e647e5c05cdff3f764efdc1b1d0b6b3f3014b6d5be8992fb11f2941bfe2e"
    },
    {
      "itemId": "alg-ctpsw-pmwvr-02",
      "itemFingerprint": "9048305a6ca11a4ac10a7758b201a03a337e4b382ee0618fa742640c92927bbd"
    },
    {
      "itemId": "alg-ctpsw-pmwvr-03",
      "itemFingerprint": "64fb7aa79943f90783deb3adc8b1ebb28edfb8486d4e8f65f22e58c979703f1a"
    },
    {
      "itemId": "alg-ctpsw-pmwvr-04",
      "itemFingerprint": "78c77d51ff6f4bbccb0da53cf6c70ee00190ec3777210e4cef734c4149c38fa5"
    },
    {
      "itemId": "alg-ctpsw-pmwvr-05",
      "itemFingerprint": "08b71670faae700b3dfd8230217c7e161ee9cc97115275b3b1ed35a4b1576563"
    },
    {
      "itemId": "alg-ctpsw-pmwvr-06",
      "itemFingerprint": "90f46a2686ab4cffb5a6f87846f274747e1c5963fbc055634ede25879d3100b5"
    }
  ],
  "targetContentVersion": "algorithms-core-0001",
  "reviewer": "product-owner-authorized-codex-review",
  "reviewDate": "2026-07-18",
  "technicalValidationEvidenceId": "technical:7fb94597edef73aec0a6182d5cedf52a6f0117b7f33d41523f4cb98a231eae6e",
  "factualAndEditorialDefectsFound": [],
  "requiredCorrections": [],
  "finalDisposition": "approved"
}
