{
  "approvalSchemaVersion": 1,
  "approvalId": "algorithms-editorial-algorithms-prefix-sums-two-dimensional-prefix-v1",
  "reviewKind": "editorial",
  "batchId": "algorithms-prefix-sums-two-dimensional-prefix-v1",
  "familyId": "algorithms",
  "trackId": "algorithms",
  "primaryTaxonomyReference": "algorithms-prefix-sums-two-dimensional-prefix-v1",
  "includedItems": [
    {
      "itemId": "alg-prefix-2d-arbitrary-rectangles-vs-window",
      "itemFingerprint": "d3e08d2e7d7b3d7b588aad9d7bb5a88d9e85eaeffcf2bd7ef9c43195c08d99c3"
    },
    {
      "itemId": "alg-prefix-2d-complexity",
      "itemFingerprint": "6604ce5121df8e8ec6fd1e9d897fcd4b9ea71474e1c0f1440f509bf00c29bd00"
    },
    {
      "itemId": "alg-prefix-2d-full-boundary-formula",
      "itemFingerprint": "dd2b2b4a18e28caf19a110104c27a45bb1ce600f34a8013cc5338c034a376536"
    },
    {
      "itemId": "alg-prefix-2d-inclusion-exclusion-order",
      "itemFingerprint": "272e61b6b435be9a712bf8f92f680c33f4cba7de14ec3f161eaaf2035dc340ee"
    },
    {
      "itemId": "alg-prefix-2d-sorting-destroys-coordinates",
      "itemFingerprint": "c2f8fd168bf87383af73380441391ad18026a47ae95621fb503ac86d7a2c5231"
    },
    {
      "itemId": "alg-prefix-2d-state-invariant",
      "itemFingerprint": "0b6e3eaf03984f4e4a60c85be7c72308d65e2f0deab0134db5411a8a5694e7b2"
    },
    {
      "itemId": "alg-prefix-2d-static-rectangle-signal",
      "itemFingerprint": "b04faa9dec162befec4952db8162e4a74a3759ef9a83032132fe2c55f5ca74b9"
    },
    {
      "itemId": "alg-prefix-2d-transfer-indicator-regions",
      "itemFingerprint": "9fa68156f27b694a7a1f93fd71b38167042bf1cd20320fa5391ca1ce51480cfb"
    }
  ],
  "targetContentVersion": "algorithms-core-0001",
  "reviewer": "product-owner-authorized-codex-review",
  "reviewDate": "2026-07-18",
  "technicalValidationEvidenceId": "technical:7f171d0ef5570b4c7d751386a91fe0d0a7173581902095c2a8f45116696aee1f",
  "factualAndEditorialDefectsFound": [],
  "requiredCorrections": [],
  "finalDisposition": "approved"
}
