{
  "approvalSchemaVersion": 1,
  "approvalId": "algorithms-editorial-algorithms-sliding-window-answer-update-and-boundaries",
  "reviewKind": "editorial",
  "batchId": "algorithms-sliding-window-answer-update-and-boundaries",
  "familyId": "algorithms",
  "trackId": "algorithms",
  "primaryTaxonomyReference": "algorithms-sliding-window-answer-update-and-boundaries",
  "includedItems": [
    {
      "itemId": "alg-sw-answer-count-valid-endings",
      "itemFingerprint": "6cd6c88e69d0e0cf6705f8c6575e97c3e5c2dc471b3abd39d258b749ef196674"
    },
    {
      "itemId": "alg-sw-answer-expansion-without-shrink",
      "itemFingerprint": "aca3dcd1088ff516cbe4900d1e0ee04348dc2c49ab6bdde28c8575649ae8b245"
    },
    {
      "itemId": "alg-sw-answer-fixed-only-at-k",
      "itemFingerprint": "9a04ce4415dcb6dfa6a7a98b6a8f54d00bdaa5e68f90d7abdcd827b62277b8e6"
    },
    {
      "itemId": "alg-sw-answer-longest-after-repair",
      "itemFingerprint": "64c953fcdb6e107fc0fd1d449a73a1cb95d30f312a40793a2fae8d96c1dc5bed"
    },
    {
      "itemId": "alg-sw-answer-no-solution-sentinel",
      "itemFingerprint": "8c8ada4c794a0205f753fd20d6d2bc3d6bcd33f459174d0b04fb7bc0a0efc119"
    },
    {
      "itemId": "alg-sw-answer-shortest-before-removal",
      "itemFingerprint": "a8726021f2246fad603df2a3f5fb6a54965d4953199acd9a9eefa3a1821e1ef8"
    }
  ],
  "targetContentVersion": "algorithms-core-0001",
  "reviewer": "product-owner-authorized-codex-review",
  "reviewDate": "2026-07-18",
  "technicalValidationEvidenceId": "technical:26bba7f182f5029fa9b86d3e5ad62f977e17ff6368b8f1d91ae970233bd875de",
  "factualAndEditorialDefectsFound": [],
  "requiredCorrections": [],
  "finalDisposition": "approved"
}
