{
  "approvalSchemaVersion": 1,
  "approvalId": "algorithms-editorial-arrays-and-strings-sequence-shape-and-edge-cases-v1",
  "reviewKind": "editorial",
  "batchId": "arrays-and-strings-sequence-shape-and-edge-cases-v1",
  "familyId": "algorithms",
  "trackId": "algorithms",
  "primaryTaxonomyReference": "arrays-and-strings-sequence-shape-and-edge-cases-v1",
  "includedItems": [
    {
      "itemId": "alg-arrays-sequence-shape-001",
      "itemFingerprint": "8046e10c2fe2bf7e3136472065046169de1d6ec1cb8a07a3faeccbd44e5f2858"
    },
    {
      "itemId": "alg-arrays-sequence-shape-002",
      "itemFingerprint": "cc4589982cf5e8eba6765d9f799a46758da20baefe497d55a556be1b28207f2c"
    },
    {
      "itemId": "alg-arrays-sequence-shape-003",
      "itemFingerprint": "f06de48ea51fb469d4e3a31f8e4b9548649da74bb4918655fd3d37e75ce063f2"
    },
    {
      "itemId": "alg-arrays-sequence-shape-004",
      "itemFingerprint": "e980b0bca79134cbcb6bb7c4b99d70b4d08b2afbe831d391c893f5fe02d56dde"
    },
    {
      "itemId": "alg-arrays-sequence-shape-005",
      "itemFingerprint": "5961a56c593b279815833debc844e8a3234fe6fbb3f8947707df6f6ad356be3e"
    },
    {
      "itemId": "alg-arrays-sequence-shape-006",
      "itemFingerprint": "30632ec39caee4788d7de97028136f7037fa121cdc16a191de60a7c54d0c63c7"
    },
    {
      "itemId": "alg-arrays-sequence-shape-008",
      "itemFingerprint": "d00ed1867a69d8932c8fc0bc78baf86c4002f223b15e1033e7d46f11d7685065"
    },
    {
      "itemId": "alg-arrays-sequence-shape-009",
      "itemFingerprint": "fd56706d896782c5fc523a306404e69fef81a8c93e024bdf434c6f6173f6742c"
    },
    {
      "itemId": "alg-arrays-sequence-shape-010",
      "itemFingerprint": "9b8f17aff911a01b825a4fbb085c172b87769de820c0c43c35bf30cb1de6690a"
    },
    {
      "itemId": "alg-arrays-sequence-shape-011",
      "itemFingerprint": "60f08f99fee66ed94a6781aaf8cb02a5295aac2386682188a2898ae0806dbee4"
    },
    {
      "itemId": "alg-arrays-sequence-shape-012",
      "itemFingerprint": "1f47c3fb4f199b90cae47ca112a0c1d8f33e21753c2496c185fc61e9f969e493"
    },
    {
      "itemId": "alg-arrays-sequence-shape-013",
      "itemFingerprint": "fb0ac2adb51d786b76bea3ff848af7f80111897ecf99e513a8b208430c680ca6"
    },
    {
      "itemId": "alg-arrays-sequence-shape-014",
      "itemFingerprint": "bca0c7f93e1ce54be9c8b6a8dd4921cb0f3ca7e1cae2db2597cd8b5ee389e21f"
    },
    {
      "itemId": "alg-arrays-sequence-shape-016",
      "itemFingerprint": "5ff8c38145534bfc5821e1baed2a2f4acf14a41c344a28f1fc5a02bf8f12ed69"
    },
    {
      "itemId": "alg-arrays-sequence-shape-017",
      "itemFingerprint": "b47bf130cf3f5fa2a1b57b89d44e9dbab6ee2341191816ec8f4f7d42a2e5e7ad"
    },
    {
      "itemId": "alg-arrays-sequence-shape-018",
      "itemFingerprint": "a186c699df0667601a8a6f58b8fe49a9eeee065dfc82cff2443937cb219f39e8"
    }
  ],
  "targetContentVersion": "algorithms-core-0001",
  "reviewer": "product-owner-authorized-codex-review",
  "reviewDate": "2026-07-18",
  "technicalValidationEvidenceId": "technical:a4381ee57268a3efc0c66e9263781b0f8cc386e227aa896856fef3757347eb8e",
  "factualAndEditorialDefectsFound": [],
  "requiredCorrections": [],
  "finalDisposition": "approved"
}
