{
  "approvalSchemaVersion": 1,
  "approvalId": "algorithms-editorial-algorithms-linked-list-dummy_and_sentinel_nodes-candidate-v1",
  "reviewKind": "editorial",
  "batchId": "algorithms-linked-list-dummy_and_sentinel_nodes-candidate-v1",
  "familyId": "algorithms",
  "trackId": "algorithms",
  "primaryTaxonomyReference": "algorithms-linked-list-dummy_and_sentinel_nodes-candidate-v1",
  "includedItems": [
    {
      "itemId": "alg-linked-list-sentinel-01-head-boundary-signal",
      "itemFingerprint": "f368c1ee0fdc9ee0ff055f5a91020a94c507a18878e6edba760f1e088b0d4fc8"
    },
    {
      "itemId": "alg-linked-list-sentinel-02-uniform-predecessor-invariant",
      "itemFingerprint": "2573c7c68ec1911fd560927bd62b8f5d44e902a151430784288f3aea4a4707c6"
    },
    {
      "itemId": "alg-linked-list-sentinel-03-empty-and-head-deletion",
      "itemFingerprint": "ff2b7be11053b77e405da904b3d9bfdbe96fa6437db7e19f7d2f80a3d04bdde6"
    },
    {
      "itemId": "alg-linked-list-sentinel-04-scaffolding-not-output",
      "itemFingerprint": "aabfb513172e0c0092dc8b9a10469e6385a41ac7f137581178acc6be134c865e"
    },
    {
      "itemId": "alg-linked-list-sentinel-05-no-arbitrary-predecessor-access",
      "itemFingerprint": "dfe1321142d35252d38cb7f2340c02979fb97b96b8e389e52a8b06cbdb52f724"
    },
    {
      "itemId": "alg-linked-list-sentinel-06-equal-value-distinct-node",
      "itemFingerprint": "0e39c306b4e5e62d372ced4285c3c36198522b956ebf39a627d0020cd7e4953a"
    },
    {
      "itemId": "alg-linked-list-sentinel-07-delete-order-with-dummy-prev",
      "itemFingerprint": "008678cd8be46ff8f168069ceef753eb158a4c95dbf7f9aa3042791079c34d55"
    },
    {
      "itemId": "alg-linked-list-sentinel-08-useful-versus-irrelevant-transfer",
      "itemFingerprint": "3c7203041e7e306d7dd6fdcc797f2b859b74b2fa4b81118bb8034f2eb45b15a9"
    }
  ],
  "targetContentVersion": "algorithms-core-0001",
  "reviewer": "product-owner-authorized-codex-review",
  "reviewDate": "2026-07-18",
  "technicalValidationEvidenceId": "technical:0626f6a372d80bcbe4aeaa4745ff1e4ca14a4677f0045d3946529857d2ddb733",
  "factualAndEditorialDefectsFound": [],
  "requiredCorrections": [],
  "finalDisposition": "approved"
}
