{
  "approvalSchemaVersion": 1,
  "approvalId": "algorithms-editorial-algorithms-linked-list-linked_list_edge_cases_and_mistakes-candidate-v1",
  "reviewKind": "editorial",
  "batchId": "algorithms-linked-list-linked_list_edge_cases_and_mistakes-candidate-v1",
  "familyId": "algorithms",
  "trackId": "algorithms",
  "primaryTaxonomyReference": "algorithms-linked-list-linked_list_edge_cases_and_mistakes-candidate-v1",
  "includedItems": [
    {
      "itemId": "alg-linked-list-mistakes-01-reachability-first-diagnostic",
      "itemFingerprint": "688076eb153069d3c4f47406cffbe6fc70b3b67849ebc8675226232aba69fed5"
    },
    {
      "itemId": "alg-linked-list-mistakes-02-classify-structural-symptoms",
      "itemFingerprint": "e604b3cc4c395d5eea6203ceeab235edcbf79be04beb6b52ea316ffaf98ece0e"
    },
    {
      "itemId": "alg-linked-list-mistakes-03-minimal-boundary-test-suite",
      "itemFingerprint": "b63ad686636db50b3f52b5ec571566640bc4bb7b2d0af2ae236c8d8348493efc"
    },
    {
      "itemId": "alg-linked-list-mistakes-04-returned-sentinel-defect",
      "itemFingerprint": "cf3f73824877d8c22e184661237d588ddccf3aab82794d0201107b893351f7a3"
    },
    {
      "itemId": "alg-linked-list-mistakes-05-index-assumption-off-by-one",
      "itemFingerprint": "8dbf3a8b330f1f3d3f63ed699acb700a6b457e9c9e0ad405e3a044a8c6d1c33c"
    },
    {
      "itemId": "alg-linked-list-mistakes-06-duplicate-values-mask-node-loss",
      "itemFingerprint": "2415ea084d96c1744a8a95d4984bb67cae2c01ba5eee939c94681ebb751768c2"
    },
    {
      "itemId": "alg-linked-list-mistakes-07-overwrite-before-save-trace",
      "itemFingerprint": "d615ccefb1576e21bacebb9dc65e14c555267dd65992344a67a638f3b41c5def"
    },
    {
      "itemId": "alg-linked-list-mistakes-08-distinguishing-aliasing-fixture",
      "itemFingerprint": "488bedb0f353c7ac7d6ac17b8d7918034ef939a217b89912ae95142741563781"
    }
  ],
  "targetContentVersion": "algorithms-core-0002",
  "reviewer": "product-owner-authorized-codex-review",
  "reviewDate": "2026-07-18",
  "technicalValidationEvidenceId": "technical:13442d5050e6eb47d8a6c7257843ecdd70cf02db0062a204a6bf19d82637ca3a",
  "factualAndEditorialDefectsFound": [],
  "requiredCorrections": [],
  "finalDisposition": "approved"
}
