{
  "approvalSchemaVersion": 1,
  "approvalId": "algorithms-editorial-contrast-binary-search-vs-linear-scan-repeated-queries-and-preprocessing-v1",
  "reviewKind": "editorial",
  "batchId": "contrast-binary-search-vs-linear-scan-repeated-queries-and-preprocessing-v1",
  "familyId": "algorithms",
  "trackId": "algorithms",
  "primaryTaxonomyReference": "contrast-binary-search-vs-linear-scan-repeated-queries-and-preprocessing-v1",
  "includedItems": [
    {
      "itemId": "alg-contrast-binary-scan-repeated-001",
      "itemFingerprint": "b1e099534103af13bd15c72b80baaa982675b71f8336e90d711d407c48954dca"
    },
    {
      "itemId": "alg-contrast-binary-scan-repeated-002",
      "itemFingerprint": "be01b68eac7ea59ecc3b82bbe2af9491cf05a81d0073c1cb5534091957270948"
    },
    {
      "itemId": "alg-contrast-binary-scan-repeated-003",
      "itemFingerprint": "025a126fa322bb85c3c0c51f4cea41f7d17c38fd2c30afd3baf35da791b75865"
    },
    {
      "itemId": "alg-contrast-binary-scan-repeated-004",
      "itemFingerprint": "d9f5756cb29424dd862c0d31e58041e939b76dede582148467271358bd7813f2"
    },
    {
      "itemId": "alg-contrast-binary-scan-repeated-005",
      "itemFingerprint": "276b263ceb4fd523d56e6831d846cd982e743ae9b11f3a529bbb9118338e647b"
    },
    {
      "itemId": "alg-contrast-binary-scan-repeated-006",
      "itemFingerprint": "3c5ede371660a331c4fe6844ab69746e166f0c666f6c392728cafcd58df6114f"
    },
    {
      "itemId": "alg-contrast-binary-scan-repeated-007",
      "itemFingerprint": "afe371071b71a540b215e7f35816c5bb6f379c643ec25a4160523fa35c75638c"
    },
    {
      "itemId": "alg-contrast-binary-scan-repeated-008",
      "itemFingerprint": "d5497b65c0462e947252f863c4820282458d9417d61f9b1521d04ebbc1a956ac"
    },
    {
      "itemId": "alg-contrast-binary-scan-repeated-009",
      "itemFingerprint": "ead29c6bb66f674d59a297c880ddc7433e6ea9a04bdaa2e349742dca2fda26ad"
    },
    {
      "itemId": "alg-contrast-binary-scan-repeated-010",
      "itemFingerprint": "985b2d9206e744f06c3bdcc156ba0ce3f4f91b030b3765b66749bd78336344e0"
    },
    {
      "itemId": "alg-contrast-binary-scan-repeated-011",
      "itemFingerprint": "a80f02afabaf980b99d71104681fa4e09839cb4118f26b57a9873e90a4fd89af"
    },
    {
      "itemId": "alg-contrast-binary-scan-repeated-012",
      "itemFingerprint": "6cb00b7361bd75a9cc3ef0f89d465d779d02ed9ca06f018b8e43de201527dd93"
    },
    {
      "itemId": "alg-contrast-binary-scan-repeated-013",
      "itemFingerprint": "50199172d679d7fc22a9ef343027625562fa435d2352baa6168b50a3b0f81a90"
    },
    {
      "itemId": "alg-contrast-binary-scan-repeated-014",
      "itemFingerprint": "695db358613d6757c9612eff0c2ba2af7519f99a0865b6660fd482c00f2c9d53"
    },
    {
      "itemId": "alg-contrast-binary-scan-repeated-015",
      "itemFingerprint": "62f8fef15ae6238358d4819a03ae2d03af85104b01555613a81754bf433bd80e"
    },
    {
      "itemId": "alg-contrast-binary-scan-repeated-016",
      "itemFingerprint": "438916e85049369441dfb53245bb899892da7e73246845cbc6c5e432f975e815"
    },
    {
      "itemId": "alg-contrast-binary-scan-repeated-017",
      "itemFingerprint": "f0a772ec1ca278b4642b4960eb8e57ee92bf632943622b9cbab294872da7932a"
    },
    {
      "itemId": "alg-contrast-binary-scan-repeated-018",
      "itemFingerprint": "a7e9da27301d896af6f9618e6fabfb60e4c7f688200258aa359bb53c892becb2"
    },
    {
      "itemId": "alg-contrast-binary-scan-repeated-019",
      "itemFingerprint": "3f2755bd44068cbfee20a985f65a16e1b0c90739fa8f18829d69aced38df601f"
    },
    {
      "itemId": "alg-contrast-binary-scan-repeated-020",
      "itemFingerprint": "ecf1de41e25a61d3daed9a500989edc4bd691f99b8addbaf2e9a6486ac294d42"
    },
    {
      "itemId": "alg-contrast-binary-scan-repeated-021",
      "itemFingerprint": "8f4e8a86cb08060d5ac40b1334604ab66a4bfca0cee8a5c379d3172aeb099d02"
    },
    {
      "itemId": "alg-contrast-binary-scan-repeated-022",
      "itemFingerprint": "6364a01eff1958f52062e9816447148bc11234ab4fca2561b0dcfe85a874c807"
    }
  ],
  "targetContentVersion": "algorithms-core-0001",
  "reviewer": "product-owner-authorized-codex-review",
  "reviewDate": "2026-07-18",
  "technicalValidationEvidenceId": "technical:0b8c1ad8227098f032b74018934e44c9f3afbd9bd602b576d490d35abb6d9fb3",
  "factualAndEditorialDefectsFound": [],
  "requiredCorrections": [],
  "finalDisposition": "approved"
}
