{
  "approvalSchemaVersion": 1,
  "approvalId": "algorithms-editorial-algorithms-graph-traversal-graph_dfs-candidate-v1",
  "reviewKind": "editorial",
  "batchId": "algorithms-graph-traversal-graph_dfs-candidate-v1",
  "familyId": "algorithms",
  "trackId": "algorithms",
  "primaryTaxonomyReference": "algorithms-graph-traversal-graph_dfs-candidate-v1",
  "includedItems": [
    {
      "itemId": "alg-gt-dfs-001",
      "itemFingerprint": "7e35a932d80682b4650b0e4eb13a584a1eb004ad60a0ac8e40e12bae36642f10"
    },
    {
      "itemId": "alg-gt-dfs-002",
      "itemFingerprint": "cdf94ed9dc727037f534b2079af1101b049d803617622168c84da154ce5e073e"
    },
    {
      "itemId": "alg-gt-dfs-003",
      "itemFingerprint": "bdf1bc105e4d844a8e9d7b89395c19a45e4188965b090a117d8fc7e7997c1619"
    },
    {
      "itemId": "alg-gt-dfs-004",
      "itemFingerprint": "abe4d48922b95b48e3fa48b853be01c847df412b6b07307568c982094cd4f457"
    },
    {
      "itemId": "alg-gt-dfs-005",
      "itemFingerprint": "ed8635b1fee056d8a6f23b6e25bc507e6feb6e5c85217b0d947bea63d0818536"
    },
    {
      "itemId": "alg-gt-dfs-006",
      "itemFingerprint": "807747abebeb3cd7eff7c287aec05d29ee17d42c342a57df2703fcaa81ad4294"
    },
    {
      "itemId": "alg-gt-dfs-007",
      "itemFingerprint": "a37bc847160ad9a6639a6d1d5b2e9a77178957ad548e65fca82cb0ef107aac35"
    }
  ],
  "targetContentVersion": "algorithms-core-0001",
  "reviewer": "product-owner-authorized-codex-review",
  "reviewDate": "2026-07-18",
  "technicalValidationEvidenceId": "technical:b983832476b7ec6851f3d3d040bd0388ac6b81f2a6fa710dd4142bca13fedbdb",
  "factualAndEditorialDefectsFound": [],
  "requiredCorrections": [],
  "finalDisposition": "approved"
}
