{
  "approvalSchemaVersion": 1,
  "approvalId": "algorithms-editorial-binary-search-boundaries-and-loop-invariants-v1",
  "reviewKind": "editorial",
  "batchId": "binary-search-boundaries-and-loop-invariants-v1",
  "familyId": "algorithms",
  "trackId": "algorithms",
  "primaryTaxonomyReference": "binary-search-boundaries-and-loop-invariants-v1",
  "includedItems": [
    {
      "itemId": "alg-binary-search-boundaries-001",
      "itemFingerprint": "b029c764a0f67648ccdb6d492d42985309db989a43164e7cae95963d3d838660"
    },
    {
      "itemId": "alg-binary-search-boundaries-002",
      "itemFingerprint": "9d32b400eaa6a92c0d0a75d00fa03004c27bf9986fc7f6a7dbc9d45fa342055f"
    },
    {
      "itemId": "alg-binary-search-boundaries-003",
      "itemFingerprint": "f4349e023150d20c508d45007c894349b60c6b30ffad9a92c71ad977ac89656f"
    },
    {
      "itemId": "alg-binary-search-boundaries-004",
      "itemFingerprint": "5d8f0b55f6f03e0ea9998216863010bc9944c50b406d2459ea3d15a92f585df4"
    },
    {
      "itemId": "alg-binary-search-boundaries-005",
      "itemFingerprint": "fa04b14a700347d18b7209623dc8edb45784ff56c9d973c303729b4de34f0dd5"
    },
    {
      "itemId": "alg-binary-search-boundaries-006",
      "itemFingerprint": "361cc832ba73219abb389a37bc4294ce48567e2ffb262d55602a7fa3cdf7e474"
    },
    {
      "itemId": "alg-binary-search-boundaries-007",
      "itemFingerprint": "d61228b743ef7a8f6f4b31c4e49dd87ef59fdaef4f150d633946a708f8f8334a"
    },
    {
      "itemId": "alg-binary-search-boundaries-008",
      "itemFingerprint": "98d6ed1ad3cfff031960dad719f0ee7e14638a5fc4fe1b85581a0adc21dbe65e"
    },
    {
      "itemId": "alg-binary-search-boundaries-009",
      "itemFingerprint": "414da4c9312076bd8e7d98269977f0c17f08209adca0a3f38e1138ba3c6e0cb4"
    },
    {
      "itemId": "alg-binary-search-boundaries-010",
      "itemFingerprint": "8884a60c30ae6d815f2b8d326627b208b518ad79a58d2f512984ca048192d8b3"
    },
    {
      "itemId": "alg-binary-search-boundaries-011",
      "itemFingerprint": "e4c0c0098d0d18859feefd31ea37b5f3862d5a3f017625565c760a56653bd751"
    },
    {
      "itemId": "alg-binary-search-boundaries-012",
      "itemFingerprint": "9cb3c18ab9c411e590bf1d698940e52d37dacb850f2dd077e861a50647b73c0b"
    },
    {
      "itemId": "alg-binary-search-boundaries-013",
      "itemFingerprint": "2510c288c0fe03bca08b0910363ec974bd2e18d8b3cd93947339d7019b06f15c"
    },
    {
      "itemId": "alg-binary-search-boundaries-014",
      "itemFingerprint": "fec31a5ff7a06dfd6070b8ab4ac4289cae805390a23a567bb23f7f98618ca743"
    },
    {
      "itemId": "alg-binary-search-boundaries-015",
      "itemFingerprint": "da2bb7c11fb35e26c833e2e95872159b811fdacbf6780291112176f5871f722b"
    },
    {
      "itemId": "alg-binary-search-boundaries-016",
      "itemFingerprint": "445010dbc7e2d2a0f5f818de1db019e5ca679081eae42b524119ebc03b5c5aeb"
    },
    {
      "itemId": "alg-binary-search-boundaries-017",
      "itemFingerprint": "b5ceb1c010b3b6d0bdcdf585b3bff6e2423d298d3ba8676d84cc891eef85de64"
    },
    {
      "itemId": "alg-binary-search-boundaries-018",
      "itemFingerprint": "ce61b7f59176891bd4219f1c66ecd3a3073d2aeb68d41cfe1a54b423a122be84"
    },
    {
      "itemId": "alg-binary-search-boundaries-019",
      "itemFingerprint": "3f134f35ebc62f25be3def0d079f8361bbd8a222a55c1ffa4f2db03f36e25d1a"
    },
    {
      "itemId": "alg-binary-search-boundaries-020",
      "itemFingerprint": "36d2d38d9023e186c332ec11f0e5b6f0c37c40c8f09085690d0eaddf3e16d602"
    },
    {
      "itemId": "alg-binary-search-boundaries-021",
      "itemFingerprint": "d34f850c971e7bc286e0bb3ae89bcebc15599cbbf9ad4c77422e54242d422ab1"
    },
    {
      "itemId": "alg-binary-search-boundaries-022",
      "itemFingerprint": "358ce1fde90086440e88fd917bbce95959aef57d5936e95b8c957abf7063f8e4"
    }
  ],
  "targetContentVersion": "algorithms-core-0001",
  "reviewer": "product-owner-authorized-codex-review",
  "reviewDate": "2026-07-18",
  "technicalValidationEvidenceId": "technical:238563ae9fe0459ef87b4c18aef1834ac123c2e38931dacb5c2b90765f038f4a",
  "factualAndEditorialDefectsFound": [],
  "requiredCorrections": [],
  "finalDisposition": "approved"
}
