{
  "approvalSchemaVersion": 1,
  "approvalId": "algorithms-editorial-algorithms-tree-traversal-subtree_return_values-candidate-001",
  "reviewKind": "editorial",
  "batchId": "algorithms-tree-traversal-subtree_return_values-candidate-001",
  "familyId": "algorithms",
  "trackId": "algorithms",
  "primaryTaxonomyReference": "algorithms-tree-traversal-subtree_return_values-candidate-001",
  "includedItems": [
    {
      "itemId": "alg-tree-subtree-bst-summary-sequence",
      "itemFingerprint": "f986601a3a4b34f9cf51bfde89eb1098802cdfb7da8f98b44af6bcda491999d3"
    },
    {
      "itemId": "alg-tree-subtree-copy-full-list-cost",
      "itemFingerprint": "0e707e1c129d6308e9665d59e5b7c264199552ff8fac1a29666203b3830ef9cb"
    },
    {
      "itemId": "alg-tree-subtree-diameter-composite-return",
      "itemFingerprint": "7bfb2b7222175f8ce6de136bea9cb67204781a2bcf5883a9c831d0fe25ef1d21"
    },
    {
      "itemId": "alg-tree-subtree-edge-height-null-identity",
      "itemFingerprint": "0831b397b6c7315fb33640089e7c373911ac0d9797d1842da1e9ebf6ce8855dc"
    },
    {
      "itemId": "alg-tree-subtree-full-property-combine",
      "itemFingerprint": "dd4e268b05c5318fda1d30cbbc5410bbba187a7cd3ebe28ae3b78c16591c3d4c"
    },
    {
      "itemId": "alg-tree-subtree-proper-tree-versus-dag",
      "itemFingerprint": "56993fd7bac5bc5f3b9913f60fa8b235fd84cb4e1a2b6bb730126be007df7568"
    }
  ],
  "targetContentVersion": "algorithms-core-0001",
  "reviewer": "product-owner-authorized-codex-review",
  "reviewDate": "2026-07-18",
  "technicalValidationEvidenceId": "technical:042ea25a4713b64461e8732a47bdd753b0e4c57048b4a061e78fe74970945b41",
  "factualAndEditorialDefectsFound": [],
  "requiredCorrections": [],
  "finalDisposition": "approved"
}
